{
  "$schema": "https://json-schema.org/draft/2020-12/schema",
  "$id": "https://github.com/byxshr/codex-paper/schemas/paper-identity-1.0.schema.json",
  "title": "Codex Paper Identity 1.0",
  "type": "object",
  "additionalProperties": false,
  "required": [
    "schemaVersion",
    "slug",
    "paperId",
    "sourceRevisionId",
    "generationId",
    "source",
    "canonical",
    "generation",
    "provenance"
  ],
  "properties": {
    "schemaVersion": { "const": "1.0.0" },
    "slug": { "type": "string", "pattern": "^[a-z0-9][a-z0-9-]*$", "maxLength": 160 },
    "paperId": {
      "type": "string",
      "pattern": "^(?:doi:.+|arxiv:[a-z0-9.-]+(?:/[0-9]+)?|source:sha256:[a-f0-9]{64})$",
      "maxLength": 320
    },
    "sourceRevisionId": { "type": "string", "pattern": "^sha256:[a-f0-9]{64}$" },
    "generationId": { "type": "string", "pattern": "^gen:sha256:[a-f0-9]{64}$" },
    "source": {
      "type": "object",
      "additionalProperties": false,
      "required": ["sha256"],
      "properties": {
        "sha256": { "type": "string", "pattern": "^[a-f0-9]{64}$" }
      }
    },
    "canonical": {
      "type": "object",
      "additionalProperties": false,
      "required": ["resolution", "primary", "aliases", "candidates", "diagnostics"],
      "properties": {
        "resolution": { "enum": ["canonical", "source_fallback"] },
        "primary": { "anyOf": [{ "$ref": "#/$defs/canonicalIdentifier" }, { "type": "null" }] },
        "aliases": {
          "type": "array",
          "items": { "$ref": "#/$defs/canonicalIdentifier" },
          "uniqueItems": true
        },
        "candidates": {
          "type": "array",
          "items": { "$ref": "#/$defs/canonicalIdentifier" },
          "uniqueItems": true
        },
        "diagnostics": {
          "type": "array",
          "items": { "$ref": "#/$defs/diagnostic" },
          "uniqueItems": true
        }
      }
    },
    "generation": {
      "type": "object",
      "additionalProperties": false,
      "required": ["fingerprint", "inputs"],
      "properties": {
        "fingerprint": {
          "type": "object",
          "additionalProperties": false,
          "required": ["algorithm", "value"],
          "properties": {
            "algorithm": { "const": "sha256" },
            "value": { "type": "string", "pattern": "^[a-f0-9]{64}$" }
          }
        },
        "inputs": { "$ref": "#/$defs/generationInputs" }
      }
    },
    "provenance": {
      "type": "object",
      "additionalProperties": false,
      "required": ["createdAt", "pluginBuildVersion", "platform"],
      "properties": {
        "createdAt": { "type": "string", "pattern": "^\\d{4}-\\d{2}-\\d{2}T\\d{2}:\\d{2}:\\d{2}(?:\\.\\d{3})?Z$" },
        "pluginBuildVersion": { "type": "string", "minLength": 1, "maxLength": 160 },
        "platform": { "type": "string", "minLength": 1, "maxLength": 80 }
      }
    }
  },
  "$defs": {
    "canonicalIdentifier": {
      "type": "object",
      "additionalProperties": false,
      "required": ["kind", "value", "sources", "confidence"],
      "properties": {
        "kind": { "enum": ["doi", "arxiv"] },
        "value": { "type": "string", "minLength": 1, "maxLength": 255 },
        "sources": {
          "type": "array",
          "minItems": 1,
          "uniqueItems": true,
          "items": { "enum": ["input_url", "pdf_front_matter_page_1", "pdf_front_matter_page_2"] }
        },
        "confidence": { "const": "high" }
      }
    },
    "diagnostic": {
      "type": "object",
      "additionalProperties": false,
      "required": ["code", "kind", "values"],
      "properties": {
        "code": { "const": "CANONICAL_ID_CONFLICT" },
        "kind": { "enum": ["doi", "arxiv"] },
        "values": {
          "type": "array",
          "minItems": 2,
          "uniqueItems": true,
          "items": { "type": "string", "minLength": 1, "maxLength": 255 }
        }
      }
    },
    "contractFile": {
      "type": "object",
      "additionalProperties": false,
      "required": ["path", "sha256"],
      "properties": {
        "path": { "type": "string", "pattern": "^(?!/)(?!.*(?:^|/)\\.\\.(?:/|$)).+$", "maxLength": 300 },
        "sha256": { "type": "string", "pattern": "^[a-f0-9]{64}$" }
      }
    },
    "generationInputs": {
      "type": "object",
      "additionalProperties": false,
      "required": [
        "sourceSha256",
        "identityPolicyVersion",
        "generationContractVersion",
        "packageVersion",
        "pluginBaseVersion",
        "evidenceSchemaVersion",
        "factsSchemaVersion",
        "reasoningSchemaVersion",
        "workflow",
        "language",
        "contextMode",
        "requestedPaperProfile",
        "parser",
        "externalSourceLocator",
        "contentContract"
      ],
      "properties": {
        "sourceSha256": { "type": "string", "pattern": "^[a-f0-9]{64}$" },
        "identityPolicyVersion": { "const": "1.0.0" },
        "generationContractVersion": { "const": "1.0.0" },
        "packageVersion": { "const": "2.1.0" },
        "pluginBaseVersion": { "const": "2.0.0" },
        "evidenceSchemaVersion": { "const": "2.0.0" },
        "factsSchemaVersion": { "const": "2.1.0" },
        "reasoningSchemaVersion": { "const": "2.0.0" },
        "workflow": { "enum": ["study", "summary"] },
        "language": { "enum": ["zh", "en"] },
        "contextMode": { "enum": ["paper-only", "canonical", "literature"] },
        "requestedPaperProfile": {
          "enum": ["auto", "empirical", "theoretical", "architecture", "system", "benchmark", "survey", "post-training", "position", "other"]
        },
        "parser": {
          "type": "object",
          "additionalProperties": false,
          "required": ["backend", "backendVersion", "contractVersion"],
          "properties": {
            "backend": { "type": "string", "minLength": 1, "maxLength": 80 },
            "backendVersion": { "type": "string", "minLength": 1, "maxLength": 80 },
            "contractVersion": { "const": "2.0.0" }
          }
        },
        "externalSourceLocator": { "anyOf": [{ "type": "string", "pattern": "^https://", "maxLength": 2048 }, { "type": "null" }] },
        "contentContract": {
          "type": "object",
          "additionalProperties": false,
          "required": ["version", "sha256", "files"],
          "properties": {
            "version": { "const": "1.0.0" },
            "sha256": { "type": "string", "pattern": "^[a-f0-9]{64}$" },
            "files": {
              "type": "array",
              "minItems": 1,
              "uniqueItems": true,
              "items": { "$ref": "#/$defs/contractFile" }
            }
          }
        }
      }
    }
  }
}
